{
  "schemaVersion": 1,
  "embeddingSpaceId": "00000000-0000-5000-8000-000000000003",
  "dimension": 100,
  "distance": "cosine",
  "distilledEncoderArtifact": "hf://dhelmy990/babel-distilled-qwen@original-demo",
  "datasetRevision": "e1acc648fcace8820dd5ee70bae9216ea4334555",
  "compatibilityVersion": "babel-online-v1"
}
